Keyword,Intent,Volume,Keyword Difficulty,CPC (USD),SERP Features
alimentos buenos para la memoria,Informational,210,25,0.02,"Sitelinks, AI Overview, Image pack, Video, Video carousel, Short videos, People also ask, Related searches"
alimentos para la memoria,Informational,720,25,0.02,"AI Overview, Image pack, Video, Video carousel, Short videos, Related searches"
alimentos para la memoria y la concentracion,Informational,110,19,0.00,"AI Overview, Video carousel, Related searches"
alimentos para mejorar la memoria,"Informational, Commercial",210,33,0.06,"AI Overview, Image pack, Video, People also ask, Related searches"
alimentos saludables para la memoria,Informational,30,20,0.00,"AI Overview, Image pack, Video, Video carousel, Related searches"
alimentos ricos para la memoria,Informational,30,21,0.00,"AI Overview, Image pack, Video, Video carousel, People also ask, Related searches"
5 alimentos para la memoria,,10,,0.00,
7 alimentos para la memoria,,0,,0.00,
9 alimentos para mejorar la memoria,,0,,0.00,
alimentación para la memoria de un bebe,,0,,0.00,
alimento buenos para la memoria,,0,,0.00,
alimento natural para mejorar la memoria,,0,,0.00,
alimento o droga pars la retencion de memoria,,0,,0.00,
alimento para el cerebro y la memoria de los niños,,0,,0.00,
alimento para mejorar la memoria pdf articulos,,0,,0.00,
alimento para que no pierdas la memoria,,0,,0.00,
alimento para reforzar la memoria,,0,,0.00,
alimentos apropiados para la memoria,,0,,0.00,
alimentos buenos para la memoria y concentracion,,10,,0.00,
alimentos buenos para la memoria y el cerebro,,20,,0.00,
alimentos malos para la memoria,,10,,0.00,
alimentos naturales para el cerebro y la memoria,,20,,0.00,
alimentos naturales para la memoria,,20,,0.00,
alimentos o bebidas para la memoria,,0,,0.00,
alimentos o remedios naturales para la memoria,,0,,0.00,
alimentos o suplementos para mejorar la memoria,,0,,0.00,
alimentos par mejorar la memoria,,0,,0.00,
alimentos para activar la memoria,,20,,0.00,
alimentos para aumentar la memoria,,20,,0.00,
alimentos para aumentar la memoria y concentracion,,20,,0.00,
alimentos para ayudar a la memoria,,20,,0.00,
alimentos para ayudar la memoria,,0,,0.00,
alimentos para cuidadr la memoria al dormir y al despertar,,0,,0.00,
alimentos para ejercitar la memoria,,0,,0.00,
alimentos para el cerebro y la memoria de um adulto,,0,,0.00,
alimentos para el cerebro y la memoria de un niño,,20,,0.00,
alimentos para estimular la memoria,,20,,0.00,
alimentos para evitar la perdida de memoria,,0,,0.00,
alimentos para fomentar la memoria en los niños,,0,,0.00,
alimentos para fortalecer e incrementar la memoria,,0,,0.00,
alimentos para fortalecer la memoria,,20,,0.00,
alimentos para incrementar la concentracion y memoria,,0,,0.00,
alimentos para la buena memoria y concentracion,,10,,0.00,
alimentos para la concentacion y memoria,,0,,0.00,
alimentos para la estimulacion de memoria en adultos mayores,,0,,0.00,
alimentos para la falta memoria,,0,,0.00,
alimentos para la inteligencia y memoria,,0,,0.00,
alimentos para la memoria de los niños,,20,,0.00,
alimentos para la memoria deficiente,,0,,0.00,
alimentos para la memoria en adultos,,30,,0.06,
alimentos para la memoria en adultos mayores,,20,,0.00,
alimentos para la memoria en niños,,20,,0.00,
alimentos para la memoria estudiar,,0,,0.00,
alimentos para la memoria para estudiar,,20,,0.00,
alimentos para la memoria para niños,,0,,0.00,
alimentos para la memoria pdf,,10,,0.00,
alimentos para la memoria y el cerebro,,20,,0.00,
alimentos para la memoria y energia,,0,,0.00,
alimentos para la memoria y la concentración,,0,,0.00,
alimentos para la memoria y prevenir demencia,,0,,0.00,
alimentos para la memoria y retencion,,0,,0.00,
alimentos para la memoria y tu cerebro,,0,,0.00,
alimentos para la memorias,,0,,0.00,
alimentos para la mente y la memoria,,10,,0.00,
alimentos para la perdida de memoria,,20,,0.00,
alimentos para mejor la memoria,,0,,0.00,
alimentos para mejorar la concentracion y la memoria,,0,,0.00,
alimentos para mejorar la concentracion y memoria,,20,,0.00,
alimentos para mejorar la memoria a corto plazo,,20,,0.00,
alimentos para mejorar la memoria a largo plazo,,0,,0.00,
alimentos para mejorar la memoria en adultos,,10,,0.00,
alimentos para mejorar la memoria en los niños,,0,,0.00,
alimentos para mejorar la memoria en niños,,10,,0.00,
alimentos para mejorar la memoria humana,,0,,0.00,
alimentos para mejorar la memoria unam,,0,,0.00,
alimentos para mejorar la memoria y concentración,,20,,0.00,
alimentos para mejorar la memoria y el aprendizaje,,0,,0.00,
alimentos para mejorar la memoria y el cerebro,,0,,0.00,
alimentos para mejorar la memoria y la concentracion,,0,,0.00,
alimentos para mejorar la retencion de memoria,,0,,0.00,
alimentos para no perder la memoria,,10,,0.00,
alimentos para no perder la memoria en adultos mayores,,0,,0.00,
alimentos para recuperar la memoria,,20,,0.00,
alimentos para reforzar la memoria,,20,,0.00,
alimentos para retener la memoria,,10,,0.00,
alimentos que ayudan para la concentracion y memoria,,0,,0.00,
alimentos que ayudan para la memoria de los niños,,0,,0.00,
alimentos que no sirven para la memoria,,0,,0.00,
alimentos que sirven para la memoria,,30,,0.00,
alimentos que sirven para la memoria y concentracion,,10,,0.00,
alimentos que sirven para retener la memoria,,0,,0.00,
alimentos son buenos para la memoria y concentracion,,0,,0.00,
alimentos y suplementos para mejorar la memoria,,0,,0.00,
alimentos y vitaminas para mejorar la memoria,,0,,0.00,
alimentoso semillas para la memoria,,0,,0.00,
buenos alimentos para la memoria,,0,,0.00,
consume alimentos para mejorar la memoria,,0,,0.00,
cuales son los alimentos para fotalecar la memoria,,0,,0.00,
cuales son los alimentos para mejorar la memoria,,0,,0.00,
imagenes de alimentos para la memoria,,0,,0.00,
infografias alimentos para la memoria,,0,,0.00,
lista de alimentos para mejorar la memoria,,0,,0.00,
los mejores alimentos para la memoria,,30,,0.00,
los mejores alimentos para mejorar la memoria,,0,,0.00,
mejores alimentos para la memoria,,20,,0.00,
metodos y alimentos para retener la memoria,,0,,0.00,
que alimento ayuda para la memoria,,0,,0.00,
que alimento es malo para el cerebro y la memoria,,0,,0.00,
que alimento sirve para la memoria wikipedia,,0,,0.00,
que alimentos comer para evitar la perdida de memoria,,0,,0.00,
que alimentos favorecen para la memoria atencion concentracion,,0,,0.00,
que alimentos me ayudan para la memoria,,0,,0.00,
que alimentos sirve para la memoria,,0,,0.00,
que alimentos son buenos para la memoria y concentracion,,10,,0.00,
que alimentos son esenciales para la memoria,,0,,0.00,
que alimentos son sanos para no perder la memoria,,0,,0.00,
que verdura o alimento para la memoria,,0,,0.00,
qué alimento me sirve para la memoria,,0,,0.00,
qué alimentos sirven para la buena memoria,,0,,0.00,
qué alimentos son buenos para evitar la pérdida de memoria,,0,,0.00,
qué alimentos son buenos para la memoria,,30,,0.00,
remedios y alimentos para la memoria,,0,,0.00,
sabe tve vivir alimentos para mejorar la memoria,,0,,0.00,
