Keyword,Intent,Volume,Keyword Difficulty,CPC (USD),SERP Features
alimentación por sonda nasogástrica en ancianos,Informational,170,17,0.00,"Sitelinks, AI Overview, Image, Image pack, Video, Video carousel, People also ask, Related searches"
que alimentos se pueden dar por sonda gástrica,Informational,260,13,0.00,"AI Overview, Image, Image pack, Video, Video carousel, Related searches"
tecnica de alimentación por sonda nasogastrica,Informational,70,23,0.00,"AI Overview, Image, Video, Video carousel, Related searches"
alimento por sonda,Informational,70,31,0.00,"AI Overview, Image, Image pack, People also ask, Related searches"
alimentación por sonda gástrica en ancianos,"Informational, Transactional",90,17,0.00,"AI Overview, Image, Image pack, Video, Video carousel, Related searches"
1056 alimentación enteral por sonda,,0,,0.00,
1056 alimentación enteral por sonda campo clase,,0,,0.00,
1056 alimentación enteral por sonda mundoenfermero,,0,,0.00,
1056 alimentación enteral por sonda recien nacido,,0,,0.00,
7 cuándo es recomendable iniciar la alimentación enteral por sonda,,0,,0.00,
administracion de alimentos por sonda gastrostomia o yeyunostomia,,0,,0.00,
administracion de alimentos por sonda nasogastrica,,10,,0.00,
alimentacion por sonda gastrica es alimentación parenteral,,0,,0.00,
alimentacion por sonda nasogastrica tipos de alimentos,,0,,0.00,
alimentacion por sonda orogastrica alimentacion forzada alimentación por succion,,0,,0.00,
alimentación artificial por sonda orogastrica,,0,,0.00,
alimentación de eliminacion por sonda,,0,,0.00,
alimentación de la persona por sonda,,0,,0.00,
alimentación en paciente neonato por sonda,,0,,0.00,
alimentación en paciente pediatrico por sonda,,0,,0.00,
alimentación enteral en niños por sonda orogastrica,,0,,0.00,
alimentación enteral por sonda codigo,,0,,0.00,
alimentación enteral por sonda codigo nic,,0,,0.00,
alimentación enteral por sonda en neonatos,,0,,0.00,
alimentación enteral por sonda fundamentos de enfermeria,,0,,0.00,
alimentación enteral por sonda invasiva,,0,,0.00,
alimentación enteral por sonda nasogastrica,,0,,0.00,
alimentación enteral por sonda nasogástrica,,0,,0.00,
alimentación enteral por sonda nasogástrica definición,,0,,0.00,
alimentación enteral por sonda nasogástrica que es,,0,,0.00,
alimentación enteral por sonda nic,,0,,0.00,
alimentación parenteral por sonda,,0,,0.00,
alimentación pediatrica por sonda nasogastrica,,0,,0.00,
alimentación pediatrica por sonda orogastrica,,0,,0.00,
alimentación por goteo en sonda neonatal,,0,,0.00,
alimentación por sonda a niños,,0,,0.00,
alimentación por sonda al dedo,,0,,0.00,
alimentación por sonda alimentos,,0,,0.00,
alimentación por sonda bebe,,0,,0.00,
alimentación por sonda de gastrostomia,,0,,0.00,
alimentación por sonda de gastrostomia pdf,,0,,0.00,
alimentación por sonda dibujo,,0,,0.00,
alimentación por sonda en adultos,,10,,0.00,
alimentación por sonda en adultos mayores,,0,,0.00,
alimentación por sonda en bolos,,0,,0.00,
alimentación por sonda en casa,,0,,0.00,
alimentación por sonda en el hogar familia de como hacerlo,,0,,0.00,
alimentación por sonda en infusión continua,,0,,0.00,
alimentación por sonda en la nariz neonatal,,0,,0.00,
alimentación por sonda en la narizneonatal,,0,,0.00,
alimentación por sonda en neonatos procedimiento,,0,,0.00,
alimentación por sonda enfermeria,,0,,0.00,
alimentación por sonda gastrostomia tecnica,,0,,0.00,
alimentación por sonda gavage,,0,,0.00,
alimentación por sonda nasigástrica,,0,,0.00,
alimentación por sonda naso gastrica,,0,,0.00,
alimentación por sonda naso gástrica en niños objetivo,,0,,0.00,
alimentación por sonda naso gástrica objetivo,,0,,0.00,
alimentación por sonda nasogastrica dibujo,,0,,0.00,
alimentación por sonda nasogastrica en animales,,0,,0.00,
alimentación por sonda nasogastrica en neonatos,,0,,0.00,
alimentación por sonda nasogastrica en pediatria,,20,,0.00,
alimentación por sonda nasogastrica flujograma,,0,,0.00,
alimentación por sonda nasogastrica objetivo,,0,,0.00,
alimentación por sonda nasogastricaa pacientes hospitalaria,,0,,0.00,
alimentación por sonda nasogástrica colocación de sonda foley,,0,,0.00,
alimentación por sonda nasogástrica cuidados de enfermería,,0,,0.00,
alimentación por sonda nasogástrica de un prematuro,,0,,0.00,
alimentación por sonda nasogástrica en adultos mayores,,10,,0.00,
alimentación por sonda nasogástrica en neonatos,,0,,0.00,
alimentación por sonda nasogástrica en niños objetivo,,0,,0.00,
alimentación por sonda nasogástrica enfermería,,0,,0.00,
alimentación por sonda nasogástrica pdf,,0,,0.00,
alimentación por sonda nasogástrica pediátrica,,0,,0.00,
alimentación por sonda nasohastricapor quintos qué es,,0,,0.00,
alimentación por sonda neonatal,,0,,0.00,
alimentación por sonda niños,,0,,0.00,
alimentación por sonda nutricion,,0,,0.00,
alimentación por sonda oro gástrica objetivo,,0,,0.00,
alimentación por sonda orogastrica en adultos,,0,,0.00,
alimentación por sonda orogastrica en bebes,,0,,0.00,
alimentación por sonda orogastrica enfermeria,,0,,0.00,
alimentación por sonda orogastrica neonatos,,10,,0.00,
alimentación por sonda orogastrica recien nacido,,0,,0.00,
alimentación por sonda orogástrica,,0,,0.00,
alimentación por sonda orogástrica concepto,,0,,0.00,
alimentación por sonda orogástrica en neonatos,,20,,0.00,
alimentación por sonda orogástrica en recién nacidos,,20,,0.00,
alimentación por sonda orogástrica objetivo,,0,,0.00,
alimentación por sonda orogástrica pdf,,0,,0.00,
alimentación por sonda orogástrica pediátrica pdf,,0,,0.00,
alimentación por sonda pdf,,0,,0.00,
alimentación por sonda ppt,,0,,0.00,
alimentación por sonda practica,,0,,0.00,
alimentación por sonda prematuros,,0,,0.00,
alimentación por sonda proc,,0,,0.00,
alimentación por sonda recien nacido,,0,,0.00,
alimentación por sonda tipo levin,,0,,0.00,
alimentación por sonda transpilórica,,0,,0.00,
alimentación por sonda yeyuna,,0,,0.00,
alimentación por sonda yeyunal,,0,,0.00,
alimentación suplementaria por medio de sonda,,0,,0.00,
alimentado por sonda,,20,,0.00,
alimentando a bebe por sonda nasogastrica,,0,,0.00,
alimentando por sonda,,10,,0.00,
alimentar por sonda,,20,,0.00,
alimentar por sonda nasogástrica,,20,,0.00,
alimentar por sonda por la boca a niños,,0,,0.00,
alimento liquido para enfermos administrada por sonda,,0,,0.00,
alimento por sonda estomago,,0,,0.00,
alimento por sonda nasogastrica,,20,,0.00,
alimentos administrados por sonda,,0,,0.00,
alimentos en dieta licuada artesanal por sonda,,0,,0.00,
alimentos indicados para pasar por sonda gastrica,,0,,0.00,
alimentos por sonda transpilorica,,0,,0.00,
alimentos que se le pueden administrar por sonda,,0,,0.00,
alimentos que se pueden dar por sonda nasogastrica,,0,,0.00,
alimentos que sí pasar por sonda,,0,,0.00,
bebes alimentados por sonda,,20,,0.00,
bebes alimentados por sonda en prematuros,,0,,0.00,
bebés alimentados por sonda,,0,,0.00,
bols para alimentar pacientes por medio de sonda,,0,,0.00,
bols para alimentar pasientes por medio de sonda,,0,,0.00,
bolsa para alimentar por sonda,,0,,0.04,
bolsa para suministrar alimento por sonda,,0,,0.00,
bolsa para sumistrar alimento por sonda,,0,,0.00,
bolsas para alimentar por sonda,,20,,0.04,
cada cuantas horas se alimenta por sonda nasogastrica,,0,,0.00,
cada cuantas horas se alimenta por sonda nasogastrica adulto mayor,,0,,0.00,
como administrar alimentos por sonda nasogastrica,,0,,0.00,
como alimentación por sonda gastrica si no acepta los suplementos,,0,,0.00,
como alimentar a un prematuro por sonda orogastrica,,0,,0.00,
como alimentar a una persona por sonda,,0,,0.00,
como alimentar paciente por sonda gastrica,,0,,0.00,
como alimentar por sonda,,20,,0.00,
como alimentar por sonda gastrica si no acepta los suplementos,,0,,0.00,
como alimentar por sonda gastrostomia,,20,,0.00,
como alimentar por sonda nasogastrica,,20,,0.00,
como funciona la sonda para alimentar por la nariz,,0,,0.00,
como hcer un alimento para pasar por sonda,,0,,0.00,
como pasar alimento por sonda nasogastrica,,30,,0.00,
como se alimenta por sonda a una tortuga de rio,,0,,0.00,
como se alimenta por sonda nasogastrica,,20,,0.00,
como se alimenta un paciente por sonda nasogastrica,,0,,0.00,
como se alimentan los enfermos por sonda,,0,,0.00,
como se ke klama alimentación por sonda en el estómago,,0,,0.00,
consideraciones para dar alimentación por sonda,,0,,0.00,
consideraciones para dar alimentación por sonda nasogástrica,,0,,0.00,
consideraciones para dar alimentación por sonda orogástrica,,0,,0.00,
contraindicaciones para alimentar por sonda de gastrostomia,,0,,0.00,
correcta administración del alimento por sonda nasogastrica,,0,,0.00,
cuidados de la alimentación enteral por sonda de gastrostomía,,0,,0.00,
cuidados y alimentación por sonda de gastrostomía en pediatría,,0,,0.00,
cuidados y alimentación por sonda de gastrostomía n,,0,,0.00,
dar alimento por una sonda nasogastrica,,0,,0.00,
dieta por sonda alimentos permitidos,,0,,0.00,
eliminacion por sonda alimentación,,0,,0.00,
en que casos no se puede alimentar por sonda nasogastrica,,0,,0.00,
equipo para alimentación por sonda nasogastrica,,0,,0.00,
estreñimiento espástico estreñimiento por sonda de alimentación,,0,,0.00,
estreñimiento por sonda de alimentación,,0,,0.00,
formula de alimentación por sonda,,0,,0.00,
fundamentacion cientifica alimentación por sonda,,0,,0.00,
fundamentación de enfermeria para la alimentación enteral por sonda,,0,,0.00,
fundamentación de la alimentación enteral por sonda,,0,,0.00,
fundamento de alimentación por sonda nasogastrica,,0,,0.00,
fundamentos de enfermeria alimentación por sonda nasogastrica,,0,,0.00,
guía de administración de medicamentos por sondas de alimentación enteral,,10,,0.00,
imagen de una niña grande que la alimentan por sonda,,0,,0.00,
imagen de una niña que la alimentan por sonda,,0,,0.00,
imagenes de alimentación por sonda orogastrica,,0,,0.00,
imagenes de bebe prematuro alimentándose por sonda nasogastrica,,0,,0.00,
indicaciones para alimentar por sonda,,0,,0.00,
instalacion cuidados y alimentación por sonda nasogastrica,,0,,0.00,
instalación cuidados y alimentación por sonda de gastrostomia para lactantes,,0,,0.00,
instalación cuidados y alimentación por sonda nasogástrica,,20,,0.00,
instalación cuidados y alimentación por sonda nasogástrica para lactantes,,0,,0.00,
instalación y alimentación por sonda nasogastrica,,0,,0.00,
intervenciones a alimentación por sonda,,0,,0.00,
jeringa para alimentación por sonda,,0,,0.00,
jeringa para alimentación por sonda nasogástrica,,0,,0.00,
medidas preventivas alimentación por sonda nasogastrica,,0,,0.00,
menos dependientes de la alimentación por sonda,,0,,0.00,
ministración de alimentación por sonda,,0,,0.00,
método de alimentación con bolos por sonda gástrica,,0,,0.00,
métodos de administración de la alimentación por sonda,,0,,0.00,
niños alimentados por sonda,,20,,0.00,
nom alimentación por sonda nasogástrica,,0,,0.00,
pacientes alimentados por sonda,,0,,0.00,
para ministración de alimentación por sonda,,0,,0.00,
para que se alimenta por sonda,,0,,0.00,
para que se alimentación por sonda,,0,,0.00,
pasos de alimentación por sonda nasogástrica,,0,,0.00,
pelicula de una chica anorexica alimentada por sonda,,0,,0.00,
perilla para administrar alimentos por sonda,,0,,0.00,
por que alimentar por sonda,,0,,0.00,
por que alimentar por sonda bebes,,0,,0.00,
por que el alimento por una sonda no es fria,,0,,0.00,
porque se alimenta por sonda nasogastrica,,0,,0.00,
preparación para alimentos por sonda,,0,,0.00,
procedimiento de alimentación por sonda en recien nacidos,,0,,0.00,
procedimiento de alimento por sonda nosogastrica,,0,,0.00,
procedimiento para alimentar al cliente por sonda nasogastrica,,0,,0.00,
procedimiento para alimentar por sonda gastrostomia,,20,,0.00,
procedimiento para alimentar por sonda nasogastrica,,0,,0.00,
procedimientos para alimentar al paciente por sonda,,0,,0.00,
procedimientos para los cuidados y alimentación por sonda de gastrostomia,,0,,0.00,
que alimentos se administra por sonda nasogastrica,,0,,0.00,
que alimentos se dan por sonda nasogastrica,,20,,0.00,
que alimentos se evitsn por sonda nasogastrica,,0,,0.00,
que alimentos se pasan por sonda nasogastrica,,0,,0.00,
que alimentos se pueden dar por sonda,,0,,0.00,
que alimentos se pueden dar por sonda gastrica,,10,,0.00,
que alimentos se pueden dar por sonda nasogastrica,,0,,0.00,
que con lleva alimentar por sonda,,0,,0.00,
que es alimentación por sonda,,0,,0.00,
que es alimentación por sonda en adultos mayores,,0,,0.00,
que es alimentación por sonda gastrostomia,,0,,0.00,
qué alimentos se pueden dar por sonda,,0,,0.00,
recomendaciones para alimentar por sonda orogastrica,,0,,0.00,
reflujo a personas alimentación por sonda,,0,,0.00,
reflujo a personas alimentadas por sonda,,0,,0.00,
riesgo de aspiración rc alimentación por sonda orogastrica,,0,,0.00,
se alimenta por la sonda orogastrica,,0,,0.00,
se alimentación por la sonda orogastrica,,0,,0.00,
se puede alimentar por sonda suplementos de proteina y carbohidratos,,0,,0.00,
solución de irrigación fisiológica para ministración de alimentación por sonda,,0,,0.00,
sonda de alimentación por sonda gastrostomía,,0,,0.00,
sonda para alimentar por estomago,,30,,0.00,
sonda para alimentar por la nariz,,30,,0.00,
sonda para alimentar por la nariz definicion,,0,,0.00,
síndrome de alimentación por sonda,,0,,0.00,
tecnica de alimentación por sonda nasogastrica en neonatos,,0,,0.00,
tecnicas de alimentación por sonda,,0,,0.00,
tecnicas de alimentación por sonda gastro,,0,,0.00,
temperatura alimento por sonda,,0,,0.00,
tipo de alimentos que lleva la dieta por sonda gasogastrica,,0,,0.00,
tipo de alimentos que lleva la dieta por sonda nasogastrica,,0,,0.00,
tipos de alimentación en paciente neonato por sonda,,0,,0.00,
tipos de alimentos para pacientes en postoperatorio por sonda,,0,,0.00,
tipos de alimentos por sonda,,0,,0.00,
tècnica de alimentación del rn por sonda sonda,,0,,0.00,
tècnica de alimentación del rn por sonda sonda nasograstrica pdf,,0,,0.00,
técnica de alimentación por sonda orogastrica pediatrico,,0,,0.00,
técnica de alimentación por sonda orogastrica pediatrico tecnica,,0,,0.00,
valoración inicial para la alimentación por sonda,,0,,0.00,
valoración inicial para la alimentación por sonda nasogastrica,,0,,0.00,
