Keyword,Intent,Volume,Keyword Difficulty,CPC (USD),SERP Features
dieta artesanal por sonda,"Informational, Transactional",90,16,0.00,"AI Overview, Image pack, Video, Video carousel, Related searches"
administracion de dieta por sonda de gastrostomia,,0,,0.00,
administracion de dieta por sonda nasogastrica,,0,,0.00,
alimentacion por sonda y dietas definicion,,0,,0.00,
alimentos en dieta licuada artesanal por sonda,,0,,0.00,
atencion enfermeria dietas por sonda,,0,,0.00,
bolsa para administracion de dieta por sonda,,0,,0.00,
como calcular una dieta por sonda para lactantes,,0,,0.00,
como se llama la dieta administrada por sonda nasogastrica,,0,,0.00,
cuales son las dietas por sonda,,0,,0.00,
dieta administrada por sonda,,0,,0.00,
dieta administrada por sonda y complicaciones,,0,,0.00,
dieta aliemntos por sonda,,0,,0.00,
dieta de 1200 calorias diarias niña para alimentacion por sonda,,0,,0.00,
dieta de especial por sonda,,0,,0.00,
dieta elemental polvo por sonda,,0,,0.00,
dieta en tercios por sonda de gastrostomia,,0,,0.00,
dieta especial por sonda,,10,,0.00,
dieta especial por sonda nasogastrica,,0,,0.00,
dieta especial por sonda nasogástrica,,20,,0.00,
dieta fraccionada en quintos nutricion por sonda,,0,,0.00,
dieta hipercalorica por sonda,,0,,0.00,
dieta hiperproteica por sonda nasogastrica,,0,,0.00,
dieta hospitalaria por sonda nasogastrica,,0,,0.00,
dieta licuada artesanal por sonda,,20,,0.00,
dieta licuada por sonda,,10,,0.00,
dieta licuada por sonda nasogastrica,,20,,0.00,
dieta licuada por sonda nasogástrica,,0,,0.00,
dieta licuado por sonda,,0,,0.00,
dieta liquida por sonda,,0,,0.00,
dieta liquida por sonda nasogastrica,,20,,0.00,
dieta polimerica por sonda nasogastrica,,0,,0.00,
dieta por sonda,,20,,0.00,
dieta por sonda alimentos permitidos,,0,,0.00,
dieta por sonda artesanal,,0,,0.00,
dieta por sonda artesanal o industrializada,,0,,0.00,
dieta por sonda de gastrostomia,,0,,0.00,
dieta por sonda en postoperatorio,,0,,0.00,
dieta por sonda en postporatorio,,0,,0.00,
dieta por sonda gastrica paciente con insuficiencia renal,,0,,0.00,
dieta por sonda gastrostomia,,20,,0.00,
dieta por sonda industrializada,,0,,0.00,
dieta por sonda menu,,0,,0.00,
dieta por sonda nasoesofagica,,0,,0.00,
dieta por sonda nasogastrica,,10,,0.00,
dieta por sonda nasogastrica alimentacion,,0,,0.00,
dieta por sonda nasogastrica alimentacion no permitida,,0,,0.00,
dieta por sonda nasogastrica ejemplo de un menu,,0,,0.00,
dieta por sonda nasogastrica en postoperatorio,,0,,0.00,
dieta por sonda nasogastricajeringa,,0,,0.00,
dieta por sonda nasogástrica,,20,,0.00,
dieta por sonda natural o industrializada,,0,,0.00,
dieta por sonda para diabetico hipertenso,,0,,0.00,
dietas artesanales por sonda,,0,,0.00,
dietas especiales por sonda,,0,,0.00,
dietas hospitalarias por sonda,,0,,0.00,
dietas liquidas por sonda,,0,,0.00,
dietas liquidas y por sonda,,0,,0.00,
dietas liquidas y por sonda pdf,,0,,0.00,
dietas liquidas y por sondas,,0,,0.00,
dietas por sonda y nutricion enteral,,0,,0.00,
ejemplo de dieta licuada por sonda,,0,,0.00,
frijol molido en dieta licuada por sonda,,0,,0.00,
menu de dieta por sonda gastrica,,0,,0.00,
menu de dieta por sonda nasogastrica,,0,,0.00,
para que es la dieta por sonda nasogastrica,,0,,0.00,
pasar en cuartos por sonda una dieta,,0,,0.00,
que tiene la dieta por sonda nasogastrica,,0,,0.00,
que tipo de dieta se administra por una sonda nasogastrica,,0,,0.00,
receta de dieta artesanal por sonda,,0,,0.00,
recomendaciones dieta artesanal por sonda,,0,,0.00,
se puede meter frijol molido en dieta licuada por sonda,,0,,0.00,
tipo de alimentos que lleva la dieta por sonda gasogastrica,,0,,0.00,
tipo de alimentos que lleva la dieta por sonda nasogastrica,,0,,0.00,
tipos de dieta por sonda,,10,,0.00,
tipos de dietas hospitalarias por sonda,,0,,0.00,
tipos de dietas por sonda nasogastrica,,0,,0.00,
una dieta para pasar por sonda de la mariz,,0,,0.00,
