Keyword,Intent,Volume,Keyword Difficulty,CPC (USD),SERP Features
nutricion geriatrica,Informational,320,23,0.30,"AI Overview, Video, Related searches"
diplomado nutricion geriatrica,,30,,0.00,
nutricion geriatrica pdf,,30,,0.00,
escala nutricional geriatrica,,20,,0.00,
indice de riesgo nutricional geriatrico,,20,,0.00,
maestria en nutricion geriatrica,,20,,0.67,
nutricion en el paciente geriatrico,,20,,0.00,
nutricion en paciente geriatrico,,20,,0.00,
que es la nutricion geriatrica,,20,,0.00,
valoracion nutricional geriatrica,,20,,0.00,
índice de riesgo nutricional geriátrico,,20,,0.00,
escala de nutricion geriatrica,,10,,0.00,
especialidad nutricion geriatrica,,10,,0.75,
historia clinica nutricional geriatrica,,10,,0.00,
master en nutricion geriatrica,,10,,0.00,
nutricion geriatrica definicion,,10,,0.00,
nutricion geriatrica maestria,,10,,0.00,
nutrición geriátrica pdf,,10,,0.00,
a partir de que edad afecta mas la nutricion geriatrica,,0,,0.00,
abcd de la nutricion geriatrica,,0,,0.00,
abcd de la nutricion geriatrica pdf,,0,,0.00,
alimentacion geriatrica nutricion uach,,0,,0.00,
alimentacion y nutricion geriatrica,,0,,0.00,
alimentación y nutrición geriátrica,,0,,0.00,
alteraciones de la nutricion como sindrome geriatrico,,0,,0.00,
alumnos de nutricion centro geriatrico,,0,,0.00,
angustia en pacientes geriatricos por mal nutricion,,0,,0.00,
antecedentes de la nutricion geriatrica,,0,,0.00,
antecedentes de nutricion geriatrica,,0,,0.00,
apoyo nutricional en paciente geriatrico,,0,,0.00,
articulo estatal de nutricion geriatrica,,0,,0.00,
articulos de nutricion en el paciente geriatrico,,0,,0.00,
articulos de nutricion en el paciente geriatrico scielo,,0,,0.00,
articulos de nutricion geriatrica,,0,,0.00,
articulos de nutricion geriatrica scielo,,0,,0.00,
articulos internacionales de nutricion geriatrica,,0,,0.00,
articulos nacionales de nutricion geriatrica,,0,,0.00,
atencion en nutricion al paciente geriatrico con patologias,,0,,0.00,
atención nutricional geriatrica,,0,,0.00,
becas doctorados españa nutricion geriatrica,,0,,0.00,
becas nutrición geriátrica,,0,,0.00,
becas nutrición geriátrica iberoamericana,,0,,0.00,
calas de valoracion geriatrica nutricional,,0,,0.00,
campaña para la nutricion geriátrica en mexico,,0,,0.00,
carrera nutricion geriatrica,,0,,0.00,
carrera nutricion geriatrica tecnicas metodos,,0,,0.00,
carrera nutricion geriatrica tecnicas metodos y procedimientos,,0,,0.00,
caso clinico de enfermeria de paciente geriatrico con deficiencia nutricional,,0,,0.00,
caso clinico de mal nutricion en paciente geriatrico,,0,,0.00,
caso clinico en paciente geriatrico con deficiencia nutricional gratis,,0,,0.00,
caso clinico geriatrico nutricion pdf,,0,,0.00,
caso clinico geriatrico nutricional,,0,,0.00,
caso clinico nutricional en paciente geriatrico,,0,,0.00,
caso clinico nutricional geriatrico,,0,,0.00,
caso clinico nutricional geriatrico hospitalizados pdf,,0,,0.00,
casos clinicos de nutricion paciente geriatrico,,0,,0.00,
causa nutricional de la depresion geriatrica,,0,,0.00,
como calcular el indice de riesgo nutricional geriatrico,,0,,0.00,
conclusion de la nutricion geriatrica,,0,,0.00,
congreso de geriatría 2018 nutricion,,0,,0.00,
consecuencia mas comun que afecta la nutricion en los geriatricos,,0,,0.00,
conseucencia de mal nutricion geriatrica,,0,,0.00,
conseucencia de mal nutricion geriatrica en mexico,,0,,0.00,
conseucencia de mal nutricion geriatrica en mexico 2017,,0,,0.00,
consideraciones especiales de la nutricion en el paciente geriatrico,,0,,0.00,
consulta nutricional geriatrico,,0,,0.00,
control nutricional para pacientes geriatricos con ulceras por presion,,0,,0.00,
cribado nutricional geriatricos,,0,,0.00,
criterios de soporte nutricional en el paciente geriatrico terminal,,0,,0.00,
criterios de soporte nutricional en el paciente geriatrico terminal espen,,0,,0.00,
criterios de soporte nutricional en el pacientes geriatrico terminal,,0,,0.00,
curso nutrición y dietética geriátrica bilbao,,0,,0.00,
curso nutrición y dietética geriátrica oviedo,,0,,0.00,
cursos de nutricion geriatrica,,0,,0.00,
definicion de nutricion geriatría hombre,,0,,0.00,
depresion geriatrica y nutricion,,0,,0.00,
diagnostico y tratamiento nutricional en pacientes geriatricos,,0,,0.00,
diagnostico y tratamiento nutricional en pacientes geriatricos desnutridos,,0,,0.00,
dieta y nutricion del paciente geriatrico,,0,,0.00,
diplomado en nutricion geriatrica,,0,,0.00,
diplomado en nutricion geriatrica en linea,,0,,0.00,
doctorado nutricion geriatrica en españa,,0,,0.00,
educacion nutricion geriatrico scielo,,0,,0.00,
ejemplo de formulacion de problema de la nutricion geriatrica,,0,,0.00,
empleos nutricion casas geriatricas monterrey,,0,,0.00,
en que consiste la nutricion geriatrica,,0,,0.00,
en que edad afecta mas la nutricion geriatrica,,0,,0.00,
encuesta nacional de salud y nutricion para geriatricos,,0,,0.00,
encuesta nacional de salud y nutrición geriátrica,,0,,0.00,
enfermedades carenciales en pacientes geriatricos intervencion nutricional,,0,,0.00,
enfermedades mentales en pacientes geriatricos intervencion nutricional,,0,,0.00,
escala de valor nutricional geriatría,,0,,0.00,
escala de valoracion de nutricion del adulto geriatrico,,0,,0.00,
escala de valoracion de nutricion en el adulto geriatrico,,0,,0.00,
escala de valoracion nutricional geriátrico,,0,,0.00,
escala de valñoracion nutricional de paciente geriatrico,,0,,0.00,
escala geriatrica de nutricion,,0,,0.00,
escala minima de evaluacion nutricional para pacientes geriatricos,,0,,0.00,
escala para valorar nutricion geriatricos,,0,,0.00,
escalas de valoracion de nutricion en el adulto geriatrico,,0,,0.00,
escalas de valoracion geriatrica nutricional,,0,,0.00,
escalas de valoracion nutricional geriatrica,,0,,0.00,
especialidad en nutricion clinica y geriatrica,,0,,0.00,
especialidad en nutricion clinica y geriatría,,0,,0.00,
especialidad en nutricion geriatrica,,0,,0.00,
especialidad nutricion geriatrica en mexico,,0,,0.00,
especialidad nutricion geriatría en mexico,,0,,0.00,
estado nutricional del paciente paciente geriatrico,,0,,0.00,
estado nutricional geriatrico,,0,,0.00,
evaluacion de la nutricion geriatrica inegi,,0,,0.00,
evaluacion de la nutricion geriatrica inegi 2019,,0,,0.00,
evaluacion nutricional del paciente geriatrico,,0,,0.00,
evaluacion nutricional en paciente geriatrico,,0,,0.00,
evaluacion nutricional en paciente geriatrico slideshare,,0,,0.00,
evaluacion nutricional geriatrica diagnostico,,0,,0.00,
evaluación del estado nutricional del paciente geriátrico,,0,,0.00,
evaluación del estado nutricional del paciente geriátrico con dinamometría,,0,,0.00,
evaluación nutricion del pacente geriatrico,,0,,0.00,
factores a considserar en atención a pacientes geriatricos en nutrición,,0,,0.00,
folletos de nutricion en paciente geriatra,,0,,0.00,
folletos de nutricion en paciente geriatrico,,0,,0.00,
formato valoracion geriatrica nutricional,,0,,0.00,
formatos de historia clinica nutricional en el paciente geriatrico,,0,,0.00,
formatos de nutricion geriatrica,,0,,0.00,
formula de estimacion nutricional para pacientes geriatricos,,0,,0.00,
geriatrico nutricion,,0,,0.00,
geriatría and nutrición,,0,,0.00,
geriatría consulta nutricional,,0,,0.00,
guia clinica nutricional geriatrica imss,,0,,0.00,
guia de practica clinica de nutricion en paciente geriatrico,,0,,0.00,
guia de tratamiento nutricional para personas geriatricas,,0,,0.00,
guia geriatrica imss nutricion,,0,,0.00,
higiene personal geriatrica en nutricion,,0,,0.00,
historia clínica nutricional geriátrica,,0,,0.00,
historia nutricional geriatrica,,0,,0.00,
historial clinico nutricional para paciente geriatrico,,0,,0.00,
importancia de la nutricion en paciente geriatrico,,0,,0.00,
importancia de la nutricion geriatrica,,0,,0.00,
importancia de pacientes geriátricos en nutrición,,0,,0.00,
indice de riesgo geriatrico nutricional,,0,,0.00,
indice de riesgo nutricional geriatrico ejemplos,,0,,0.00,
indice de riesgo nutricional geriatrico formula,,0,,0.00,
indice de riesgo nutricional geriatrico pdf,,0,,0.00,
indice de riesgo nutricional geriatrico que es,,0,,0.00,
indice de riesgo nutricional geriátrico,,0,,0.00,
indice riesgo nutricional geriatrico,,0,,0.00,
instituto nacional de geriatría nutrición curso,,0,,0.00,
instituto nacional de nutricion geriatría,,0,,0.00,
intepreracion mini tes de nutricion geriatrica,,0,,0.00,
intervención nutricional de pacientes geriatricos con epoc,,0,,0.00,
justificación de tesis documental nutricion de paciente geriatrico,,0,,0.00,
libro blanco nutrición geriatrica,,0,,0.00,
libro de evaluacion del estado nutricional en paciente geriatrico,,0,,0.00,
libro terapia geriatrica y nutricion,,0,,0.00,
los sindromes geriatricos y la nutricion,,0,,0.00,
maestría en nutrición geriátrica,,0,,0.00,
mal nutricion geriatrica,,0,,0.00,
manejo nutricional del paciente geriatrico con ira,,0,,0.00,
manejo nutricional diabetes y nefropatia paciente geriatrico,,0,,0.00,
manual de nutricion geriatrica,,0,,0.00,
manual de nutricion geriatrica filetype pdf,,0,,0.00,
manual de nutricion geriatría filetype pdf,,0,,0.00,
master nutricion geriatrica,,0,,0.00,
metodos de diagnostico nutricional valoracion geriatrica,,0,,0.00,
metodos de diagnostico nutricional valoracion geriatrica integral,,0,,0.00,
mna nutricion geriatrica,,0,,0.00,
monitoreo nutricional geriatrico,,0,,0.00,
nimportancia de la nutricion geriatrica,,0,,0.00,
nutricion clinica geriatrica,,0,,0.00,
nutricion clinica geriatrica libros,,0,,0.00,
nutricion clinica geriatría,,0,,0.00,
nutricion clinica geriatría libros,,0,,0.00,
nutricion clinica y geriatrica,,0,,0.00,
nutricion del paciente geriatrico,,0,,0.00,
nutricion del paciente geriatrico en osteoporosis,,0,,0.00,
nutricion e hidratacion en pacientes geriatricos,,0,,0.00,
nutricion en el adulto y paciente geriatrico,,0,,0.00,
nutricion en el paciente geriatrico imss,,0,,0.00,
nutricion en el paciente geriatrico pdf,,0,,0.00,
nutricion en el paciente geriatrico scielo,,0,,0.00,
nutricion en geriatrica,,0,,0.00,
nutricion en geriatrico en mexico,,0,,0.00,
nutricion en geriatricos,,0,,0.00,
nutricion en geriatricos institucionalizados,,0,,0.00,
nutricion en geriatricos institucionalizados pdf,,0,,0.00,
nutricion en geriatría,,0,,0.00,
nutricion en paciente geriatrico en estado critico pdf,,0,,0.00,
nutricion en paciente geriatrico pdf,,0,,0.00,
nutricion en pacientes geriatricos pdf,,0,,0.00,
nutricion en personas geriatricas,,0,,0.00,
nutricion ennpaciente geriatrico,,0,,0.00,
nutricion enteral y parenteral en pacientes geriatricos,,0,,0.00,
nutricion geriatrica articulo,,0,,0.00,
nutricion geriatrica articulos,,0,,0.00,
nutricion geriatrica by scielo pdf,,0,,0.00,
nutricion geriatrica caso clinico,,0,,0.00,
nutricion geriatrica caso clinico para resilver,,0,,0.00,
nutricion geriatrica cursos,,0,,0.00,
nutricion geriatrica dibujo,,0,,0.00,
nutricion geriatrica en asilo,,0,,0.00,
nutricion geriatrica en mexico,,0,,0.00,
nutricion geriatrica glosario,,0,,0.00,
nutricion geriatrica inovacion,,0,,0.00,
nutricion geriatrica libro,,0,,0.00,
nutricion geriatrica libros,,0,,0.00,
nutricion geriatrica logotipo,,0,,0.00,
nutricion geriatrica manual,,0,,0.00,
nutricion geriatrica morley español,,0,,0.00,
nutricion geriatrica oms,,0,,0.00,
nutricion geriatrica pdf panamericana,,0,,0.00,
nutricion geriatrica png,,0,,0.00,
nutricion geriatrica portadas,,0,,0.00,
nutricion geriatrica ppt,,0,,0.00,
nutricion geriatrica requerimientos nutricionales,,0,,0.00,
nutricion geriatrica requerimintos nutrcionales,,0,,0.00,
nutricion geriatrica slideshare,,0,,0.00,
nutricion geriatrica tecnicas metodos,,0,,0.00,
nutricion geriatrica tips,,0,,0.00,
nutricion geriatrica universidad mundial,,0,,0.00,
nutricion geriatrica vectorización,,0,,0.00,
nutricion geriatrica vegetariana,,0,,0.00,
nutricion geriatrica y economia,,0,,0.00,
nutricion gerontologica y geriatrica pdf,,0,,0.00,
nutricion hospitalaria 2011 estimacion de peso geriatricos,,0,,0.00,
nutricion hospitalaria oncologia geriatrica,,0,,0.00,
nutricion hospitalaria oncologia geriatrica y nutricion,,0,,0.00,
nutricion neoplasia geriatrica,,0,,0.00,
nutricion paciente geriatrico,,0,,0.00,
nutricion paciente geriatrico libros,,0,,0.00,
nutricion para pacientes geriatricos,,0,,0.00,
nutricion parenteral en paciente geriatrico,,0,,0.00,
nutricion parenteral total en paciente geriatrico,,0,,0.00,
nutricion perros geriatricos,,0,,0.00,
nutricion perros geriatricos.pdf,,0,,0.00,
nutricion y hidratacion en pacientes geriatricos,,0,,0.00,
nutricion y metabolismo geriatricos,,0,,0.00,
nutrición 20 geriatrica adulto 20mayor modulo 8.pdf,,0,,0.00,
nutrición en adultos y geriatría,,0,,0.00,
nutrición en paciente geriátrico con osteoartritis,,0,,0.00,
nutrición en síndromes geriátricos,,0,,0.00,
nutrición geriatrica imss,,0,,0.00,
nutrición geriatrica libros,,0,,0.00,
nutrición geriátrica 2018,,0,,0.00,
nutrición geriátrica 2018 ppt,,0,,0.00,
nutrición geriátrica artículos,,0,,0.00,
nutrición geriátrica definición,,0,,0.00,
objetivo para la nutricion enteral en el px geriatrico,,0,,0.00,
omega 3 en nutricion geriatrica,,0,,0.00,
orientacion nutricional geriatrica,,0,,0.00,
paciente geriatrico nutricion,,0,,0.00,
paciente geriatrico nutricion filetype pdf,,0,,0.00,
paciente geriatrico nutrición problemas,,0,,0.00,
paciente geriatrico tratamiento nutricional estreñimiento,,0,,0.00,
paciente geriátrico nutricion,,0,,0.00,
plan nutricional para pacientes geriatrico con desnutricion,,0,,0.00,
por que genera mal nutricion geriatrico,,0,,0.00,
prescripcion nutricional geriatrica,,0,,0.00,
principales riesgos de la nutricion geriatrica,,0,,0.00,
problema principal de la nutricion geriatrica,,0,,0.00,
programas de nutricion para geriatricos en saltillo,,0,,0.00,
prueba de tamizaje nutricional recomendada para paciente geriatrico,,0,,0.00,
que es nutricion geriatrica,,0,,0.00,
que estudia la nutricion geriatrica,,0,,0.00,
que hace la nutricion geriatrica,,0,,0.00,
quintero m r 1993 nutrición en los ancianos geriátrica 27-31,,0,,0.00,
reflexiones sobre nutrición geriatrica,,0,,0.00,
resumen de nutricion geriatrica,,0,,0.00,
signos en la nutricion geriatrica,,0,,0.00,
sindromes geriatricos demencia delirio mal nutrición depresión y ansiedad,,0,,0.00,
sindromes geriatricos mal nutricion,,0,,0.00,
sindromes geriatricos mal nutricion inmovilidad,,0,,0.00,
sindromes geriatricos nutricion,,0,,0.00,
sindromes geriatricos nutricion caricatura,,0,,0.00,
sindromes geriatricos y nutricion,,0,,0.00,
sintomas en la nutricion geriatrica,,0,,0.00,
sintomas que se presentan en la nutricion geriatrica,,0,,0.00,
soporte nutricional en paciente critico geriatrico,,0,,0.00,
soporte nutricional en paciente geriatrico,,0,,0.00,
soporte nutricional geriatrica,,0,,0.00,
soporte nutricional geriatrico,,0,,0.00,
suplemento nutricional para sindrome geriatrico,,0,,0.00,
tabla iv indicaciones de la nutrición enteral en pacientes geriatricos,,0,,0.00,
tablas geriatricas de nutricion,,0,,0.00,
tamizaje nutricional geriatrico,,0,,0.00,
tamizaje nutricional geriatricos,,0,,0.00,
terapia geriatrica y nutricion,,0,,0.00,
tesina documental de nutricion en pacientes geriatricos justificacion,,0,,0.00,
tipos de nutricion en paciente geriatrico,,0,,0.00,
tratado de gerontología y geriatría clínica nutrición y envejecimiento 199,,0,,0.00,
tratamiento nutricional en pacientes geriatricos,,0,,0.00,
tratamiento nutricional paciente geriatrico con anemia,,0,,0.00,
uintero m r 1993 nutrición en los ancianos geriátrica 27-31,,0,,0.00,
valoracion geriatrica en nutricion del adulto mayor,,0,,0.00,
valoracion geriatrica nutricion,,0,,0.00,
valoracion geriatrica nutricional,,0,,0.00,
valoracion nutricional del paciente geriatrico,,0,,0.00,
valoracion nutricional geriatrica mna,,0,,0.00,
valoracion nutricional geriatrico,,0,,0.00,
valoración geriátrica integral repercusión en su estado nutricional,,0,,0.00,
valoración geriátrica integral repercusión en su estado nutricional 2016,,0,,0.00,
valoración geriátrica integral repercusión en su estado nutricional rizo 2016,,0,,0.00,
valoración geriátrica integral repercusión en su estado nutricional rizo2016,,0,,0.00,
índice de riesgo nutricional geriátrico formula,,0,,0.00,
índice de riesgo nutricional geriátrico geriatric nutritional risk index gnri,,0,,0.00,
índice de riesgo nutricional geriátrico gnri,,0,,0.00,
índice geriatrico nutricional,,0,,0.00,
